{
 "schema_version": "1.1.0",
 "generator": {
  "name": "analysis/detector.py",
  "version": "0.1.0"
 },
 "session": {
  "id": "demo-6x2",
  "start_time_iso": "2026-10-25T18:00:00+00:00",
  "duration_s": 1039.998,
  "sample_rate_hz": 416.0,
  "accel_range_g": 16,
  "gyro_range_dps": 2000,
  "hand_worn": "R",
  "hand": "rear",
  "stance": "orthodox",
  "sensor_mount": "hand_wrap",
  "devices": [
   {
    "device_id": "sensor",
    "hand": "rear",
    "wrist": "R",
    "firmware_version": null,
    "sample_rate_hz": 416.0,
    "calibrated": true,
    "clock": {
     "source": "device",
     "offset_s": 0.0,
     "skew_ppm": 0.0,
     "residual_ms": null,
     "sync_points": 0
    }
   }
  ],
  "calibration": {
   "guard_gravity_g": [
    -0.4856,
    -0.2855,
    -0.8256
   ],
   "forward_axis": [
    -0.8695,
    0.254,
    0.4235
   ],
   "t_start_s": 4.832,
   "t_end_s": 6.644
  }
 },
 "detector_params": {
  "threshold_g": 3.5,
  "refractory_ms": 150,
  "window_ms": 150
 },
 "rounds": [
  {
   "index": 0,
   "t_start_s": 12.0,
   "t_end_s": 132.0,
   "kind": "round"
  },
  {
   "index": 1,
   "t_start_s": 132.0,
   "t_end_s": 192.0,
   "kind": "rest"
  },
  {
   "index": 2,
   "t_start_s": 192.0,
   "t_end_s": 312.0,
   "kind": "round"
  },
  {
   "index": 3,
   "t_start_s": 312.0,
   "t_end_s": 372.0,
   "kind": "rest"
  },
  {
   "index": 4,
   "t_start_s": 372.0,
   "t_end_s": 492.0,
   "kind": "round"
  },
  {
   "index": 5,
   "t_start_s": 492.0,
   "t_end_s": 552.0,
   "kind": "rest"
  },
  {
   "index": 6,
   "t_start_s": 552.0,
   "t_end_s": 672.0,
   "kind": "round"
  },
  {
   "index": 7,
   "t_start_s": 672.0,
   "t_end_s": 732.0,
   "kind": "rest"
  },
  {
   "index": 8,
   "t_start_s": 732.0,
   "t_end_s": 852.0,
   "kind": "round"
  },
  {
   "index": 9,
   "t_start_s": 852.0,
   "t_end_s": 912.0,
   "kind": "rest"
  },
  {
   "index": 10,
   "t_start_s": 912.0,
   "t_end_s": 1032.0,
   "kind": "round"
  }
 ],
 "punches": [
  {
   "id": 0,
   "t_peak_s": 6.4928,
   "t_start_s": 6.4303,
   "t_end_s": 6.5385,
   "type": "cross",
   "confidence": 1.0,
   "target": "head",
   "hand": "R",
   "peak_g": 5.626,
   "speed_mps_est": 2.25,
   "duration_ms": 108.2,
   "gyro_int_dps_s": [
    53.74,
    -2.02,
    -18.83
   ],
   "saturated": false,
   "round_index": null,
   "device_id": "sensor"
  },
  {
   "id": 1,
   "t_peak_s": 13.9952,
   "t_start_s": 13.9375,
   "t_end_s": 14.0361,
   "type": "spinning_backfist",
   "confidence": 0.872,
   "target": "head",
   "hand": "R",
   "peak_g": 5.148,
   "speed_mps_est": 1.95,
   "duration_ms": 98.6,
   "gyro_int_dps_s": [
    2.32,
    -16.15,
    -244.06
   ],
   "saturated": false,
   "round_index": 0,
   "device_id": "sensor"
  },
  {
   "id": 2,
   "t_peak_s": 14.2957,
   "t_start_s": 14.2115,
   "t_end_s": 14.3486,
   "type": "spinning_backfist",
   "confidence": 0.745,
   "target": "head",
   "hand": "R",
   "peak_g": 7.902,
   "speed_mps_est": 3.872,
   "duration_ms": 137.0,
   "gyro_int_dps_s": [
    47.89,
    10.99,
    -8.53
   ],
   "saturated": false,
   "round_index": 0,
   "device_id": "sensor"
  },
  {
   "id": 3,
   "t_peak_s": 14.6346,
   "t_start_s": 14.5481,
   "t_end_s": 14.6827,
   "type": "rear_hook",
   "confidence": 0.679,
   "target": "head",
   "hand": "R",
   "peak_g": 8.266,
   "speed_mps_est": 4.075,
   "duration_ms": 134.6,
   "gyro_int_dps_s": [
    -57.11,
    -11.52,
    139.69
   ],
   "saturated": false,
   "round_index": 0,
   "device_id": "sensor"
  },
  {
   "id": 4,
   "t_peak_s": 17.9808,
   "t_start_s": 17.9135,
   "t_end_s": 18.0264,
   "type": "overhand",
   "confidence": 0.925,
   "target": "head",
   "hand": "R",
   "peak_g": 7.181,
   "speed_mps_est": 3.132,
   "duration_ms": 113.0,
   "gyro_int_dps_s": [
    -35.75,
    82.55,
    31.47
   ],
   "saturated": false,
   "round_index": 0,
   "device_id": "sensor"
  },
  {
   "id": 5,
   "t_peak_s": 18.363,
   "t_start_s": 18.2764,
   "t_end_s": 18.4159,
   "type": "rear_uppercut",
   "confidence": 0.979,
   "target": null,
   "hand": "R",
   "peak_g": 6.175,
   "speed_mps_est": 3.323,
   "duration_ms": 139.4,
   "gyro_int_dps_s": [
    57.09,
    -134.53,
    -27.41
   ],
   "saturated": false,
   "round_index": 0,
   "device_id": "sensor"
  },
  {
   "id": 6,
   "t_peak_s": 22.1755,
   "t_start_s": 22.1034,
   "t_end_s": 22.2236,
   "type": "cross",
   "confidence": 1.0,
   "target": "head",
   "hand": "R",
   "peak_g": 9.747,
   "speed_mps_est": 3.991,
   "duration_ms": 120.2,
   "gyro_int_dps_s": [
    46.97,
    13.52,
    11.07
   ],
   "saturated": false,
   "round_index": 0,
   "device_id": "sensor"
  },
  {
   "id": 7,
   "t_peak_s": 24.9952,
   "t_start_s": 24.8846,
   "t_end_s": 25.0841,
   "type": "kick_or_body_movement",
   "confidence": 0.3,
   "target": null,
   "hand": null,
   "peak_g": 0.936,
   "speed_mps_est": null,
   "duration_ms": 201.9,
   "gyro_int_dps_s": [
    -4.39,
    -17.5,
    60.68
   ],
   "saturated": false,
   "round_index": 0,
   "device_id": "sensor"
  },
  {
   "id": 8,
   "t_peak_s": 25.6442,
   "t_start_s": 25.5601,
   "t_end_s": 25.6971,
   "type": "cross",
   "confidence": 0.803,
   "target": "head",
   "hand": "R",
   "peak_g": 6.305,
   "speed_mps_est": 3.192,
   "duration_ms": 137.0,
   "gyro_int_dps_s": [
    41.35,
    9.31,
    -26.81
   ],
   "saturated": false,
   "round_index": 0,
   "device_id": "sensor"
  },
  {
   "id": 9,
   "t_peak_s": 26.1394,
   "t_start_s": 26.0673,
   "t_end_s": 26.1875,
   "type": "cross",
   "confidence": 1.0,
   "target": "head",
   "hand": "R",
   "peak_g": 6.54,
   "speed_mps_est": 2.885,
   "duration_ms": 120.2,
   "gyro_int_dps_s": [
    31.55,
    8.21,
    9.68
   ],
   "saturated": false,
   "round_index": 0,
   "device_id": "sensor"
  },
  {
   "id": 10,
   "t_peak_s": 30.3341,
   "t_start_s": 30.2596,
   "t_end_s": 30.3822,
   "type": "rear_hook",
   "confidence": 0.666,
   "target": "head",
   "hand": "R",
   "peak_g": 6.94,
   "speed_mps_est": 3.142,
   "duration_ms": 122.6,
   "gyro_int_dps_s": [
    -9.65,
    -12.02,
    110.03
   ],
   "saturated": false,
   "round_index": 0,
   "device_id": "sensor"
  },
  {
   "id": 11,
   "t_peak_s": 30.8053,
   "t_start_s": 30.7404,
   "t_end_s": 30.8486,
   "type": "unknown",
   "confidence": 0.2,
   "target": null,
   "hand": "R",
   "peak_g": 5.924,
   "speed_mps_est": 2.452,
   "duration_ms": 108.2,
   "gyro_int_dps_s": [
    36.7,
    7.36,
    -52.7
   ],
   "saturated": false,
   "round_index": 0,
   "device_id": "sensor"
  },
  {
   "id": 12,
   "t_peak_s": 31.1274,
   "t_start_s": 31.0457,
   "t_end_s": 31.1851,
   "type": "spinning_backfist",
   "confidence": 0.892,
   "target": "head",
   "hand": "R",
   "peak_g": 8.38,
   "speed_mps_est": 4.056,
   "duration_ms": 139.4,
   "gyro_int_dps_s": [
    -36.19,
    9.95,
    -230.02
   ],
   "saturated": false,
   "round_index": 0,
   "device_id": "sensor"
  },
  {
   "id": 13,
   "t_peak_s": 33.5817,
   "t_start_s": 33.5192,
   "t_end_s": 33.625,
   "type": "overhand",
   "confidence": 1.0,
   "target": "head",
   "hand": "R",
   "peak_g": 9.642,
   "speed_mps_est": 3.659,
   "duration_ms": 105.8,
   "gyro_int_dps_s": [
    -27.5,
    105.25,
    16.93
   ],
   "saturated": false,
   "round_index": 0,
   "device_id": "sensor"
  },
  {
   "id": 14,
   "t_peak_s": 33.9495,
   "t_start_s": 33.8822,
   "t_end_s": 33.9976,
   "type": "unknown",
   "confidence": 0.2,
   "target": null,
   "hand": "R",
   "peak_g": 7.292,
   "speed_mps_est": 3.157,
   "duration_ms": 115.4,
   "gyro_int_dps_s": [
    67.58,
    -63.02,
    -13.0
   ],
   "saturated": false,
   "round_index": 0,
   "device_id": "sensor"
  },
  {
   "id": 15,
   "t_peak_s": 34.4351,
   "t_start_s": 34.363,
   "t_end_s": 34.4808,
   "type": "rear_uppercut",
   "confidence": 0.818,
   "target": null,
   "hand": "R",
   "peak_g": 5.453,
   "speed_mps_est": 2.543,
   "duration_ms": 117.8,
   "gyro_int_dps_s": [
    42.53,
    -71.78,
    0.31
   ],
   "saturated": false,
   "round_index": 0,
   "device_id": "sensor"
  },
  {
   "id": 16,
   "t_peak_s": 34.8846,
   "t_start_s": 34.8101,
   "t_end_s": 34.9303,
   "type": "rear_hook",
   "confidence": 0.511,
   "target": "head",
   "hand": "R",
   "peak_g": 16.263,
   "speed_mps_est": 6.72,
   "duration_ms": 120.2,
   "gyro_int_dps_s": [
    -1.52,
    24.14,
    104.75
   ],
   "saturated": true,
   "round_index": 0,
   "device_id": "sensor"
  },
  {
   "id": 17,
   "t_peak_s": 38.5,
   "t_start_s": 38.4279,
   "t_end_s": 38.5457,
   "type": "rear_uppercut",
   "confidence": 0.815,
   "target": null,
   "hand": "R",
   "peak_g": 9.591,
   "speed_mps_est": 4.063,
   "duration_ms": 117.8,
   "gyro_int_dps_s": [
    22.74,
    -71.5,
    30.87
   ],
   "saturated": false,
   "round_index": 0,
   "device_id": "sensor"
  },
  {
   "id": 18,
   "t_peak_s": 38.8654,
   "t_start_s": 38.7957,
   "t_end_s": 38.9135,
   "type": "overhand",
   "confidence": 0.517,
   "target": "head",
   "hand": "R",
   "peak_g": 8.659,
   "speed_mps_est": 3.495,
   "duration_ms": 117.8,
   "gyro_int_dps_s": [
    16.03,
    66.55,
    -26.44
   ],
   "saturated": false,
   "round_index": 0,
   "device_id": "sensor"
  },
  {
   "id": 19,
   "t_peak_s": 39.3606,
   "t_start_s": 39.2812,
   "t_end_s": 39.4135,
   "type": "rear_hook",
   "confidence": 0.626,
   "target": "head",
   "hand": "R",
   "peak_g": 10.52,
   "speed_mps_est": 4.745,
   "duration_ms": 132.2,
   "gyro_int_dps_s": [
    -18.43,
    -33.76,
    126.76
   ],
   "saturated": false,
   "round_index": 0,
   "device_id": "sensor"
  },
  {
   "id": 20,
   "t_peak_s": 39.8077,
   "t_start_s": 39.738,
   "t_end_s": 39.851,
   "type": "unknown",
   "confidence": 0.2,
   "target": null,
   "hand": "R",
   "peak_g": 10.203,
   "speed_mps_est": 4.262,
   "duration_ms": 113.0,
   "gyro_int_dps_s": [
    44.51,
    22.92,
    -54.69
   ],
   "saturated": false,
   "round_index": 0,
   "device_id": "sensor"
  },
  {
   "id": 21,